"id";"title";"topic_id";"slug";"content";"created";"updated";"image";"image_caption";"edit_group_id"
50;"How can I view a survey's data products available for a particular star/galaxy/group?";27;"data-access-how-can-i-view-a-surveys-data-products-available-for-a-particular-stargalaxygroup";"<p>For users wanting to&nbsp;<span>browse the available data, data products, and meta-data provided by&nbsp;a particular survey, use the <a href=""http://datacentral.aao.gov.au/asvo/data-access/data-browser/"">Data Browser</a> Tool. For help using the Data Browser, check out all the&nbsp;<a href=""http://datacentral.aao.gov.au/asvo/docs/help-center/data-browser/"">Data Browser Articles</a>.&nbsp;</span></p>";"2016-09-21 15:59:37.333581+08";"2016-10-07 07:09:41.327726+08";"";"";
53;"A guide to using the Query Builder";2;"query-a-guide-to-using-the-query-builder";"<p>Follow the step by step instructions on how to use the Query Builder</p> <div class=""row""> <div class=""col-xs-12""> <div class=""sub-heading question""> <div class=""helper step step1"">Choose a catalogue, then select properties you wish to return. Add multiple catalogues and properties using the button.</div> </div> </div> </div> <div class=""row""> <div class=""col-xs-12""> <div class=""sub-heading question""> <div class=""helper step step2"">If you have selected multiple catalogues, you must join them using this panel.</div> </div> </div> </div> <div class=""row""> <div class=""col-xs-12""> <div class=""sub-heading question""> <div class=""helper step step3"">Choose criteria to filter the selection by.</div> </div> </div> </div> <div class=""row""> <div class=""col-xs-12""> <div class=""sub-heading question""> <div class=""helper step step4"">Any warnings will show here. Once you've fixed them, view the generated SQL. (Optional) Copy-paste this into the SQL box below to edit your query.</div> </div> </div> </div> <div class=""row""> <div class=""col-xs-12""> <div class=""sub-heading question""> <div class=""helper step step5"">Check all fields are populated, then submit your query!</div> </div> </div> </div>";"2016-09-22 18:08:09.431477+08";"2016-09-22 18:18:47.77206+08";"";"";
54;"How are data organised in the Schema Browser?";3;"schema-browser-how-are-data-organised-in-the-schema-browser";"Content";"2016-10-06 10:12:00.289949+08";"2016-10-06 10:12:00.289977+08";"";"";
55;"How can I search the Schema Browser?";3;"schema-browser-how-can-i-search-the-schema-browser";"Content";"2016-10-06 10:12:18.581125+08";"2016-10-06 10:12:18.581169+08";"";"";
56;"How can I view the schema for a particular branch and version?";3;"schema-browser-how-can-i-view-the-schema-for-a-particular-branch-and-version";"Content";"2016-10-06 10:12:47.656208+08";"2016-10-06 10:12:47.656239+08";"";"";
51;"Which tool do I need? View use cases for the ADC tools.";27;"data-access-which-tool-do-i-need-view-use-cases-for-the-adc-tools";"<p><span>ADC survey&nbsp;data can be accessed in a multitude of ways, depending on your data needs. Please note that ADC is still in development, and this table may change.</span></p> <table class=""table table-striped table-bordered table-condensed""><colgroup> <col width=""40%"" /> <col width=""10%"" /> <col width=""10%"" /> <col width=""10%"" /> <col width=""10%"" /> <col width=""10%"" /> <col width=""10%"" /> </colgroup> <thead> <tr> <th>Use Case</th> <th><a>Data Browser</a></th> <th>Query Builder</th> <th>Data Explorer</th> <th>SQL</th> <th>SOV</th> <th>Position Search</th> </tr> </thead> <tbody> <tr> <td> <h4 class=""no-margin-top"">Survey Exploration</h4> <span>I want to browse the available data products, and meta-data for the astronomical objects (stars/galaxies/groups) in a particular survey. I want to download data products for a sample of objects from that survey.</span></td> <td><span class=""fa fa-check""></span>&nbsp;</td> <td>&nbsp;</td> <td>&nbsp;</td> <td>&nbsp;</td> <td>&nbsp;</td> <td>&nbsp;</td> </tr> <tr> <td> <h4 class=""no-margin-top"">Single Object</h4> <span>I know the object identifier according to the survey, e.g., GAMA object G65406. I want to explore and download the available data products for this object&nbsp;from <em>all</em> surveys.</span></td> <td>&nbsp;</td> <td>&nbsp;</td> <td>&nbsp;</td> <td>&nbsp;</td> <td>&nbsp;<span class=""fa fa-check""></span></td> <td>&nbsp;</td> </tr> <tr> <td> <h4 class=""no-margin-top"">Multiple objects from the same survey</h4> <span>I have a list of object IDs or positions of sources that reside in a survey (e.g., GAMA sources G65406, G106376). I wish to return survey-derived parameters for those sources (e.g., redshifts from GAMA catalogue SpecObjAll).</span></td> <td>&nbsp;<span class=""fa fa-check""></span></td> <td>&nbsp;<span class=""fa fa-check""></span></td> <td>&nbsp;</td> <td>&nbsp;<span class=""fa fa-check""></span></td> <td>&nbsp;</td> <td>&nbsp;</td> </tr> <tr> <td> <h4 class=""no-margin-top"">Create and return a sample from a survey</h4> <span>I want to create a sample of objects from a particular survey, filtering on some parameter(s) and return available rows of objects across several catalogues.&nbsp;</span></td> <td>&nbsp;</td> <td>&nbsp;<span class=""fa fa-check""></span></td> <td>&nbsp;</td> <td>&nbsp;<span class=""fa fa-check""></span></td> <td>&nbsp;</td> <td>&nbsp;</td> </tr> <tr> <td> <h4 class=""no-margin-top"">Download Data Products for a generatated sample.</h4> <span>I want to create a sample of objects from multiple surveys, filtering on some parameter(s) and select data products (from all surveys) to download for the resultant sample.</span></td> <td>&nbsp;</td> <td>&nbsp;<span class=""fa fa-check""></span></td> <td>&nbsp;</td> <td>&nbsp;<span class=""fa fa-check""></span></td> <td>&nbsp;</td> <td>&nbsp;</td> </tr> <tr> <td> <h4 class=""no-margin-top"">Multiple Objects from different surveys</h4> <span>I want to view the closest sources to an uploaded list of RA, DEC coordinates within some radius.</span></td> <td>&nbsp;</td> <td>&nbsp;</td> <td>&nbsp;</td> <td>&nbsp;</td> <td>&nbsp;</td> <td><span class=""fa fa-check""></span>&nbsp;</td> </tr> <tr> <td> <h4 class=""no-margin-top"">Cross match my sources with a survey</h4> <span>I want to upload a list of RA, DEC positions and cross match to all available survey objects, to within some radius.</span></td> <td>&nbsp;</td> <td>&nbsp;</td> <td>&nbsp;</td> <td>&nbsp;</td> <td>&nbsp;</td> <td><span class=""fa fa-check""></span>&nbsp;</td> </tr> <tr> <td> <h4 class=""no-margin-top"">At Position</h4> <span>I want to view available data for some radius around RA, DEC coordinates.</span></td> <td>&nbsp;</td> <td>&nbsp;</td> <td>&nbsp;<span class=""fa fa-check""></span></td> <td>&nbsp;</td> <td>&nbsp;</td> <td>&nbsp;<span class=""fa fa-check""></span></td> </tr> <tr> <td> <h4 class=""no-margin-top"">Look for available data</h4> <span>I want to view imaging (where available) and source positions for the AAT surveys.</span></td> <td>&nbsp;</td> <td>&nbsp;</td> <td>&nbsp;<span class=""fa fa-check""></span></td> <td>&nbsp;</td> <td>&nbsp;</td> <td>&nbsp;</td> </tr> </tbody> </table>";"2016-09-21 16:05:10.753321+08";"2016-10-07 07:37:32.837124+08";"";"";
25;"How are data organised in the Data Browser?";1;"data-browser-how-are-data-organised-in-the-data-browser";"<p>Surveys hosted at AAODC are are&nbsp;<code>samples</code>&nbsp;containing&nbsp;<code>astronomical objects</code>. You can read more about our data model <a href=""../data-central-data-model/"">here</a>, or our middleware python package, FIDIA&nbsp;<a href=""../schema/"">here</a>.</p> <p>Within the Data Browser, data are organised hierarchically, according to the following structure:</p> <dl class=""""> <dt></dt> <dt>survey/</dt> <dd>Available survey objects, products, schema browser etc. <br />e.g, <a href=""http://datacentral.aao.gov.au/asvo/data-access/data-browser/sami/"">data-browser/sami/</a></dd> <dt>survey/galaxy</dt> <dd>Available data for the object 'galaxy'. <br />e.g, <a href=""http://datacentral.aao.gov.au/asvo/data-access/data-browser/sami/24433/"">data-browser/sami/24433/</a></dd> <dt>survey/galaxy/property/</dt> <dd>Displays an on-the-fly rendering of the property (if sensible). Download in a variety of formats [fits, json, csv]. <br />e.g, <a href=""http://datacentral.aao.gov.au/asvo/data-access/data-browser/sami/24433/line_emission_map-OII3729"">data-browser/sami/24433/line_emission_map-OII3729</a></dd> <dt>survey/galaxy/property/attribute</dt> <dd>Displays a list of the attributes for the property. <br />e.g, <a href=""http://datacentral.aao.gov.au/asvo/data-access/data-browser/sami/24433/line_emission_map-OII3729/value/"">data-browser/sami/24433/line_emission_map-OII3729/value/</a></dd> </dl> <p>&nbsp;</p>";"2016-08-31 14:28:35.48437+08";"2016-10-07 08:06:39.939021+08";"";"";
57;"How do I use the Schema Browser?";3;"schema-browser-how-do-i-use-the-schema-browser";"<div class=""row""> <div class=""col-xs-12 col-sm-12""> <ol class=""p""> <li>Search the sidebar for a particular type of data. Choose a data product to view its documentation.</li> <li>The documentation for the chosen type of data is shown in this panel.</li> <li>The schema for each data product will typically contain: <ol> <li>Documentation: a detailed description of the selected data.</li> <li>Properties: descriptions of the associated data properties.</li> <li>Downloadable Formats: a list of formats the data can be downloaded as.</li> <li>All Available Branches and Previous Versions: a comprehensive table of all the available branches and versions for this type of data. Use the branch and version description dropdown to at the top of the schema to switch between branches and versions.</li> </ol> </li> </ol> <img class=""img-responsive"" src=""../../../../static/restapi_app/img/documentation/articles/schema_browser/schema_browser_blank.png"" /></div> </div>";"2016-10-06 12:25:45.217658+08";"2016-10-06 16:43:05.167809+08";"";"";
58;"Bulk Data Downloads";27;"data-access-bulk-data-downloads";"<p><span>All data can be downloaded directly from ADC using the</span><span>&nbsp;</span><a href=""http://rsync.samba.org/""><span>rsync</span></a><span> or </span><a href=""http://www.gnu.org/software/wget/"">wget</a><span> commands. The urls to use are the same as you would use in a web browser, but with the relevant download format appended i.e.,&nbsp;<a href=""http://datacentral.aao.gov.au/asvo/data-access/data-browser/sami/24433/line_emission_map-HALPHA/?format=fits"">http://datacentral.aao.gov.au/asvo/data-access/data-browser/sami/24433/line_emission_map-HALPHA/?format=fits</a></span></p> <p><span>For a detailed description of the directory structure, see the <a href=""http://datacentral.aao.gov.au/asvo/docs/articles/data-central-data-model/"">Data Model</a>, and to check available file formats, check the <a href=""http://datacentral.aao.gov.au/asvo/data-access/schema/"">Schema Browser</a>.&nbsp;</span></p> <p>Note: the total SAMI data volume is &gt; 1TB, and GAMA &gt; 10TB. If you need a significant fraction of that data (&gt;50GB), please <a href=""http://datacentral.aao.gov.au/asvo/support/contact/"">contact us</a>&nbsp;to arrange a data transfer.&nbsp;</p> <h3>Data Products</h3> <p>Data products as derived by the survey teams are documented in the <a href=""http://datacentral.aao.gov.au/asvo/data-access/schema/"">Schema Browser</a>.&nbsp;These can be directly downloaded from the links in the <a href=""http://datacentral.aao.gov.au/asvo/data-access/data-browser/"">Data Browser</a>, or via wget commands.</p> <p>For example, to download the&nbsp;[NII] (6583&Aring;) and&nbsp;[OII] (3729&Aring;)&nbsp;emission line flux&nbsp;maps for SAMI galaxy 24433:</p> <pre>wget \<br /><a href=""http://datacentral.aao.gov.au/asvo/data-access/data-browser/sami/24433/line_emission_map-OII3729/?format=fits"">http://datacentral.aao.gov.au/asvo/data-access/data-browser/sami/24433/line_emission_map-OII3729/?format=fits</a> \ <br /><a href=""http://datacentral.aao.gov.au/asvo/data-access/data-browser/sami/24433/line_emission_map-NII6583/?format=fits"">http://datacentral.aao.gov.au/asvo/data-access/data-browser/sami/24433/line_emission_map-NII6583/?format=fits</a> <br /><br /></pre> <p>or alternatively, use the links on the Available Data&nbsp;section in the Data Browser page for <a href=""http://datacentral.aao.gov.au/asvo/data-access/data-browser/sami/24433/"">SAMI 24433</a>.&nbsp;</p> <h3>Catalogs&nbsp;</h3> <p>Catalogs of parameters derived by survey teams can be directly downloaded from the&nbsp;<a href=""http://datacentral.aao.gov.au/asvo/data-access/data-browser/"">Data Browser</a>&nbsp;using the Multiple objects section in the Survey section (e.g, <a href=""http://datacentral.aao.gov.au/asvo/data-access/data-browser/sami/"">SAMI</a>).&nbsp;</p> <p>&nbsp;</p>";"2016-10-06 18:57:32.563923+08";"2016-10-07 07:45:03.307392+08";"";"";
52;"How do I download data products for a sample of SAMI galaxies?";27;"data-access-how-do-i-download-data-products-for-a-sample-of-sami-galaxies";"<p>To define a sample of SAMI objects, use the table of catalog properties (under the&nbsp;<strong>Multiple Objects</strong> tab in the <a href=""http://datacentral.aao.gov.au/asvo/data-access/data-browser/sami/"">SAMI Data Browser</a>&nbsp;page), which allows for filtering and searching.</p> <p><img class=""img-responsive img-thumbnail"" style=""padding: 30px;"" src=""../../../../static/documentation/img/data_access/data_access_1.png"" /></p> <p>Data products for your&nbsp;sample of galaxies can be downloaded for offline use using the&nbsp;<strong>Download Data Products</strong> application.</p> <p><img class=""img-responsive img-thumbnail"" style=""padding: 30px;"" src=""../../../../static/documentation/img/data_access/data_access_2.png"" /></p> <p>Download your selected objects and data products (as .gz.tar) using the <span class=""fa fa-download""></span>&nbsp;Download button.</p> <p><img class=""img-responsive img-thumbnail"" style=""padding: 30px;"" src=""../../../../static/documentation/img/data_access/data_access_3.png"" /></p> <p><span>To access data via a command line interface, read the documentation on <a href=""http://datacentral.aao.gov.au/asvo/docs/articles/data-access-bulk-data-downloads/"">bulk data downloads.</a></span></p>";"2016-09-21 16:58:08.506268+08";"2016-10-07 07:41:59.621097+08";"";"";
42;"What is a Data Release?";4;"data-central-what-is-a-data-release";"<p>A data release is marked by the <span class=""fa fa-map-marker""></span>&nbsp;symbol, and represents a collection of data products a survey team has made publicly available. Survey teams typically release new-and-improved data products with each release, but if you ran your analysis on a particular piece of data at a particular time, data releases allow you to view a specific time-stamped version of the survey products.</p> <p>The <a href=""http://datacentral.aao.gov.au/asvo/data-access/data-browser/"">Data Browser</a> will always show the most current Data Release for a survey, but you can switch to view previous data releases using the <a class=""btn btn-default btn-xs dropdown-toggle"" type=""button"" data-toggle=""dropdown""> Data Releases </a> button.</p>";"2016-09-01 10:31:54.886408+08";"2016-10-07 08:03:35.951867+08";"";"";
